{
  "$schema": "https://json-schema.org/draft/2020-12/schema",
  "$id": "ael:cli-json-result-and-exit-status@0.1",
  "title": "AEL CLI JSON result",
  "type": "object",
  "required": ["contract_version", "command", "status", "exit_code", "runs"],
  "additionalProperties": false,
  "properties": {
    "contract_version": {"const": "0.1"},
    "command": {"type": "string", "minLength": 1},
    "status": {"enum": ["success", "partial", "failure"]},
    "exit_code": {"enum": [0, 1, 3]},
    "started_at": {"type": "string", "pattern": "^\\d{4}-\\d{2}-\\d{2}T\\d{2}:\\d{2}:\\d{2}(\\.\\d+)?Z$"},
    "runs": {"type": "array", "items": {"$ref": "#/$defs/run"}}
  },
  "$defs": {
    "run": {
      "type": "object",
      "required": ["source_alias", "account_alias", "status"],
      "additionalProperties": false,
      "properties": {
        "source_alias": {"type": "string", "pattern": "^[a-z0-9][a-z0-9_-]*$"},
        "account_alias": {"type": "string", "pattern": "^[a-z0-9][a-z0-9_-]*$"},
        "status": {"enum": ["success", "failed", "skipped_due_manual", "skipped_locked"]},
        "retries_used": {"type": "integer", "minimum": 0},
        "retry_budget": {"type": "integer", "minimum": 0},
        "last_error_code": {"type": "string", "pattern": "^[a-z0-9_]+$"}
      }
    }
  }
}
