{"contract_version":"0.1","command":"collect --all","status":"partial","exit_code":3,"runs":[{"source_alias":"byteplus","account_alias":"bp01","status":"failed","retries_used":3,"retry_budget":3,"last_error_code":"http_429"},{"source_alias":"forgejo","account_alias":"forge-main","status":"success"},{"source_alias":"deepseek","account_alias":"deepseek-main","status":"skipped_due_manual"}]}
